{
  "$schema": "./patch-schema.json",
  "schemaVersion": 1,
  "patchedAt": "2026-09-27T00:00:00Z",
  "add": {
    "highAbuseTlds": [
      "top", "xyz", "buzz", "click", "fit", "rest", "tk", "cf", "gq", "ml", "ga",
      "work", "cam", "surf", "loan", "racing", "icu", "gdn", "vip", "monster",
      "country", "stream", "date", "faith", "review", "download", "trade", "webcam",
      "win", "men", "party", "science", "cricket", "accountant", "mom", "sbs",
      "cfd", "skin", "quest", "beauty", "hair", "makeup", "cyou", "best", "boats",
      "bond", "lol", "bid"
    ],
    "adNetworks": [
      "doubleclick.net", "googleadservices.com", "googlesyndication.com", "2mdn.net",
      "adnxs.com", "adnxs.net", "adsrvr.org", "amazon-adsystem.com",
      "criteo.com", "criteo.net", "taboola.com", "outbrain.com",
      "pubmatic.com", "rubiconproject.com", "casalemedia.com",
      "openx.net", "openx.com", "smartadserver.com", "moatads.com",
      "adform.net", "adform.com", "mgid.com", "revcontent.com",
      "popads.net", "popcash.net", "propellerads.com",
      "serving-sys.com", "adsafeprotected.com", "doubleverify.com",
      "teads.tv", "sharethrough.com", "contextweb.com",
      "bidswitch.net", "rlcdn.com", "adservice.google.com",
      "ads.google.com", "pagead2.googlesyndication.com",
      "adroll.com", "adsterra.com", "inmobi.com", "ironsrc.com",
      "vungle.com", "adcolony.com", "spotxchange.com", "spotx.tv",
      "mediavine.com", "ezoic.com", "ezoic.net", "sovrn.com",
      "appnexus.com", "exoclick.com", "undertone.com",
      "conversantmedia.com", "exponential.com", "media.net",
      "monetizemore.com", "yieldmo.com", "triplelift.com", "triplelift.net",
      "connatix.com", "aniview.com", "springserve.com", "smaato.net",
      "chartboost.com", "applovin.com", "applovinmax.com",
      "unityads.unity3d.com", "unityads.com", "liftoff.io",
      "mintegral.com", "adkernel.com", "yieldlove.com",
      "smartclip.tv", "smartclip.net", "admob.com",
      "indexexchange.com", "gumgum.com", "teads.com",
      "nativo.com", "pangle.io", "pangleglobal.com",
      "loopme.com", "ogury.com", "fyber.com",
      "inner-active.com", "inneractive.com", "digitalturbine.com",
      "tapjoy.com", "adbuddiz.com", "tradplus.com",
      "emxdigital.com", "emxdgt.com", "rocketfuel.com",
      "yahoodsp.com", "media.yahoo.com", "amobee.com",
      "beeswax.io", "beeswax.com", "stackadapt.com",
      "choozle.com", "basis.net", "thetradedesk.com",
      "mediamath.com", "dataxu.com", "yieldify.com",
      "zergnet.com", "gravity.com", "adthrive.com",
      "adpushup.com", "adprime.com", "adhese.com",
      "adrecovery.com", "adfox.ru", "adfox.net",
      "vidazoo.com", "brid.tv", "jwplatform.com",
      "minutemedia.com", "adglare.net", "glomex.com",
      "loopme.me", "pubgalaxy.com", "sortable.com",
      "adtelligent.com", "getadmiral.com", "admiraldrm.com",
      "admiralservices.com", "admiralcloud.com",
      "carter-carrier.com", "whisperingwax.com", "chiseledcherry.com",
      "defiantdigital.com", "spitefulsoup.com", "sylvansteam.com",
      "decklibrary.com", "credential.net", "incongruousmeasure.com",
      "defiantiron.com", "familiarrailway.com", "greasyloss.com",
      "fundingchoicesmessages.google.com", "fc.yahoo.com",
      "btloader.com", "blockthrough.com", "blockthrough.net",
      "pagefair.com", "pagefair.net",
      "adinplay.com", "adinplay.bid", "adinplay.eu",
      "fuckadblock.com", "blockadblock.com", "antiblock.org",
      "snack-media.com", "adblockdetector.com", "adunblock.com",
      "yavli.com", "realsrv.com", "antiadblocksystems.com",
      "anti-adblock.herokuapp.com", "nitropay.com",
      "snigelweb.com", "snigel.com"
    ],
    "trackerNetworks": [
      "google-analytics.com", "googleanalytics.com",
      "googletagmanager.com", "googletagservices.com",
      "analytics.google.com", "scorecardresearch.com", "quantserve.com",
      "branch.io", "app.link", "appsflyer.com", "adjust.com", "adjust.io",
      "kochava.com", "singular.net", "tenjin.io", "tenjin.com",
      "airbridge.io", "rockerbox.com", "northbeam.io", "triplewhale.com", "elevar.com",
      "mixpanel.com", "amplitude.com", "segment.io", "segment.com",
      "rudderstack.com", "rudderlabs.com", "mparticle.com", "lytics.com",
      "tealium.com", "tiqcdn.com", "ensighten.com", "exponea.com",
      "bloomreach.com", "pendo.io", "appcues.com", "appcues.net",
      "walkme.com", "userpilot.io", "userflow.com", "chameleon.io", "intercom.io",
      "hotjar.com", "fullstory.com", "mouseflow.com", "inspectlet.com",
      "crazyegg.com", "luckyorange.com", "woopra.com", "sessioncam.com",
      "decibelinsight.net", "contentsquare.net", "contentsquare.com",
      "smartlook.com", "logrocket.com", "logrocket.io", "glassbox.com",
      "quantum-metric.com", "quantummetric.com", "uxcam.com", "clarity.ms",
      "sentry.io", "nr-data.net", "newrelic.com", "rollbar.com",
      "bugsnag.com", "raygun.io", "raygun.com", "instana.com",
      "dynatrace.com", "elastic.co", "honeycomb.io",
      "optimizely.com", "launchdarkly.com", "statsig.com",
      "growthbook.io", "flagsmith.com", "configcat.com",
      "split.io", "kameleoon.com", "vwo.com", "conductrics.com",
      "braze.com", "braze.eu", "iterable.com", "onesignal.com",
      "pushwoosh.com", "airship.com", "urbanairship.com",
      "clevertap.com", "customerio.com", "swrve.com",
      "leanplum.com", "localytics.com", "xtremepush.com",
      "demdex.net", "omtrdc.net", "everesttech.net",
      "bluekai.com", "krxd.net", "agkn.com", "tapad.com",
      "exelator.com", "liveramp.com", "liveramp.net", "stickyads.tv",
      "connect.facebook.net", "facebook.net",
      "tr.snapchat.com", "sc-static.net",
      "ads.linkedin.com", "analytics.tiktok.com", "business.tiktok.com",
      "trackcmp.net", "clicky.com", "statcounter.com", "flurry.com",
      "heap.io", "heapanalytics.com", "loggly.com",
      "matomo.cloud", "piwik.pro", "qualtrics.com", "userzoom.com",
      "kissmetrics.io", "adlooxtracking.com", "s-onetag.com",
      "bounceexchange.com", "wunderkind.co",
      "sl-edge.com", "dnsdelegation.io",
      "fingerprint.com", "fingerprintjs.com", "posthog.com", "plausible.io",
      "chartbeat.com", "chartbeat.net", "parsely.com", "parse.ly",
      "sailthru.com", "klaviyo.com", "klaviyomail.com",
      "marketo.com", "marketo.net", "eloqua.com",
      "hubspot.com", "hsforms.com", "hubspotlinks.com",
      "pardot.com", "actmcdn.com", "act-on.com", "hubapi.com"
    ],
    "cloudSuffixes": [
      "azure.com", "azure.net", "azureedge.net", "azurefd.net", "azure-api.net",
      "azurewebsites.net", "azurecontainer.io", "azurecr.io", "azurestaticapps.net",
      "azure-devices.net", "azure-automation.net", "cloudapp.net", "windows.net",
      "windowsazure.com", "trafficmanager.net", "msecnd.net", "service.signalr.net",
      "microsoft.com", "microsoftonline.com", "live.com", "office.com", "office.net",
      "office365.com", "sharepoint.com", "outlook.com", "skype.com", "bing.com",
      "msn.com", "windows.com", "windowsupdate.com", "microsoftstore.com",
      "msedge.net", "s-microsoft.com", "msftconnecttest.com", "msftncsi.com",
      "visualstudio.com", "gfx.ms",
      "amazonaws.com", "amazon.com", "cloudfront.net", "awsstatic.com",
      "amazontrust.com", "a2z.com", "media-amazon.com", "ssl-images-amazon.com",
      "amazonvideo.com", "primevideo.com", "awsglobalaccelerator.com",
      "elasticbeanstalk.com", "apprunner.com", "elb.amazonaws.com",
      "googleapis.com", "google.com", "gstatic.com", "googleusercontent.com",
      "gvt1.com", "gvt2.com", "gvt3.com", "1e100.net", "appspot.com",
      "googlehosted.com", "withgoogle.com", "googlezip.net", "ggpht.com",
      "gmail.com", "youtube.com", "ytimg.com", "googlevideo.com", "android.com",
      "chromium.org", "blogger.com", "gcr.io", "pkg.dev", "cloudfunctions.net",
      "run.app", "firebaseio.com", "firebaseapp.com", "web.app",
      "oracle.com", "oraclecloud.com", "oraclegovcloud.com", "oraclecorp.com",
      "ibm.com", "bluemix.net", "ibmcloud.com",
      "aliyun.com", "alibabacloud.com", "myqcloud.com", "tencentcloudapi.com",
      "digitalocean.com", "digitaloceanspaces.com", "ondigitalocean.com",
      "linode.com", "linodeobjects.com", "members.linode.com",
      "vultr.com", "vultrobjects.com",
      "hetzner.com", "hetzner.de", "your-server.de",
      "ovh.com", "ovh.net", "ovhcloud.com",
      "scaleway.com", "scw.cloud",
      "leaseweb.com", "hostinger.com", "bluehost.com", "godaddy.com", "namecheap.com",
      "docker.com", "docker.io", "postman.com", "auth0.com", "okta.com",
      "oktacdn.com", "docusign.net", "docusign.com",
      "supabase.com", "supabase.co", "supabase.net", "supabase.in",
      "backblazeb2.com", "wasabisys.com", "r2.cloudflarestorage.com",
      "neon.tech", "neon.build", "planetscale.com", "psdb.cloud",
      "turso.io", "turso.tech", "upstash.io", "convex.dev", "convex.cloud",
      "together.ai", "groq.com", "mistral.ai", "deepseek.com",
      "perplexity.ai", "replicate.com", "replicate.delivery"
    ],
    "cdnSuffixes": [
      "cloudflare.com", "cloudflare.net", "cloudflare-dns.com", "cdn.cloudflare.net",
      "fastly.net", "fastlylb.net", "dualstack.fastly.net", "prod.fastly.net",
      "fastly.com", "map.fastly.net",
      "akamai.net", "akamaized.net", "akamaihd.net", "akamaiedge.net",
      "edgekey.net", "edgesuite.net", "akamai.com", "akadns.net",
      "akamaitechnologies.com", "akamaistream.net", "srip.net", "tl88.net",
      "gslb.akamai.com", "akamai-staging.net", "akamai-edge.net",
      "jsdelivr.net", "unpkg.com", "bootstrapcdn.com", "fontawesome.com",
      "jquery.com", "cdnjs.com",
      "stackpathcdn.com", "stackpath.com", "bunny.net", "b-cdn.net",
      "keycdn.com", "kxcdn.com", "gcore.com", "gcorelabs.com", "gcdn.co",
      "cdn77.com", "cdn77.org", "cachefly.net", "edgio.net",
      "limelight.com", "edgecastcdn.net", "llnwd.net", "cdngslb.com",